{
  "subnetId": "nQCwF6V9y8VFjvMuPeQVWWYn6ba75518Dpf6ZMWZNb3NyTA94",
  "network": "mainnet",
  "categories": [
    "GAMING",
    "METAVERSE",
    "NFT"
  ],
  "name": "DOS",
  "description": "DOS Chain is an Avalanche L1 designed for high-throughput decentralized applications (dApps), offering near-instant finality and ultra-low fees. It combines EVM compatibility with a unique distributed operating system model, making it ideal for scalable DeFi, gaming, and enterprise solutions.",
  "logo": "https://cdn.snowpeer.io/dos.png",
  "website": "https://doschain.com",
  "socials": [
    {
      "name": "twitter",
      "url": "https://twitter.com/DOS_Chain"
    },
    {
      "name": "linkedin",
      "url": "https://www.linkedin.com/company/doschain/"
    },
    {
      "name": "telegram",
      "url": "https://t.me/DOSChain"
    },
    {
      "name": "discord",
      "url": "https://discord.com/invite/DOS"
    }
  ],
  "chains": [
    {
      "blockchainId": "22v7AG7h6qaVxd4bLvAsSsg2LZ4RCn5iVYgFn7a2Fj1LCuYwjv",
      "name": "DOS Chain",
      "description": "",
      "evmChainId": 7979,
      "vmName": "EVM",
      "vmId": "X5tFvg9JwoXgaYPQbceSzhGoCF6dhwrDm5BnAav6meFp3xxmg",
      "rpcUrls": ["https://main.doschain.com"],
      "nativeToken": {
        "symbol": "DOS",
        "name": "DOS",
        "decimals": 18,
        "logoUri": "https://cdn.snowpeer.io/dos.png"
      },
      "sybilResistanceType": "Proof of Authority"
    }
  ],
  "isL1": false
}
