{
  "subnetId": "subnet-id-here",
  "isL1": false,
  "network": "mainnet",
  "categories": ["DEFI", "GAMING"],
  "name": "Chain Name",
  "description": "Chain description here",
  "logo": "https://example.com/logo.png",
  "website": "https://example.com",
  "socials": [
    {
      "name": "twitter",
      "url": "https://twitter.com/example"
    },
    {
      "name": "telegram",
      "url": "https://t.me/example"
    },
    {
      "name": "discord",
      "url": "https://discord.gg/example"
    }
  ],
  "chains": [
    {
      "blockchainId": "blockchain-id-here",
      "name": "Chain Name",
      "description": "Blockchain description",
      "evmChainId": 12345,
      "vmName": "EVM",
      "vmId": "vm-id-here",
      "sybilResistanceType": "Proof of Stake",
      "explorerUrl": "https://explorer.example.com",
      "rpcUrls": [
        "https://rpc.example.com"
      ],
      "nativeToken": {
        "symbol": "TOKEN",
        "name": "Token Name",
        "decimals": 18,
        "logoUri": "https://example.com/token-logo.png"
      }
    }
  ]
}
