{
  "subnetId": "f6ewGNYxGRjQ1SFfhL2tiHCMHzz9AHdTuPe11dRNarGbp3dES",
  "network": "mainnet",
  "categories": [
    "RWA",
    "HEALTH"
  ],
  "name": "Letsbuyhealthcare",
  "description": "Providing a fast affordable way to access and prepare for the cost of private healthcare.",
  "logo": "https://cdn.snowpeer.io/lets.svg",
  "website": "https://letsbuyhealthcare.com",
  "socials": [],
  "chains": [
    {
      "blockchainId": "29vwJsYDCuAHpCCGkvvWh8K2MiHAyCXYKUNobCMg4c7ZQvSkJu",
      "name": "Letsbuyhealthcare",
      "description": "",
      "evmChainId": 50776,
      "vmName": "EVM",
      "vmId": "",
      "rpcUrls": [
        "https://subnets.avax.network/letsbuyhc/mainnet/rpc"
      ],
      "nativeToken": {
        "symbol": "LBHG",
        "name": "LBHG",
        "decimals": 18,
        "logoUri": "https://images.ctfassets.net/gcj8jwzm6086/62KzIedYATHGgRODAP5Py9/e290f4d8598ac8d30d80975a560cca8f/AvaCloud-512x512.png"
      },
      "sybilResistanceType": "Proof of Authority"
    }
  ],
  "isL1": true
}
