{
  "subnetId": "axp7DUSPvFghTM883ug2B8btAReBAACxD1VyENmRDStH4Lfed",
  "network": "mainnet",
  "categories": [
    "GAMING"
  ],
  "name": "PLYR PHI",
  "description": "PLYR Network is a blockchain gaming platform that integrates a multi-chain ecosystem for developers and gamers. It offers staking, gaming clusters, and opportunities for asset management, supporting decentralized game economies. With a focus on seamless gaming experiences, it aims to redefine Web3 gaming. PLYR supports tools for developers to enhance game creation and distribution.",
  "logo": "https://cdn.snowpeer.io/plyr.png",
  "website": "https://plyr.network/",
  "socials": [
    {
      "name": "twitter",
      "url": "https://x.com/OnPlyr"
    },
    {
      "name": "discord",
      "url": "https://discord.com/invite/plyr"
    },
    {
      "name": "telegram",
      "url": "https://t.me/plyrchain"
    },
    {
      "name": "medium",
      "url": "https://onplyr.medium.com/"
    }
  ],
  "chains": [
    {
      "blockchainId": "HUwWdyoExrb1HgVp5X5sh3AWqhYFnKkfXBfGmGL3qjDsnMoR4",
      "name": "PLYRPHI",
      "description": "The PLYR gaming chain offers low-cost, fast, and secure transactions for gaming. It enables seamless in-game purchases, asset transfers, and integrates with over 200 networks, providing a robust foundation for innovative and cross-chain gaming experiences.",
      "evmChainId": 16180,
      "vmName": "EVM",
      "vmId": "cN7RT4fKXmpuL9xLVXbc8CK7pYzT3YDkVX9uVAAK9T4QH6bTa",
      "rpcUrls": [
        "https://subnets.avax.network/plyr/mainnet/rpc"
      ],
      "nativeToken": {
        "symbol": "PLYR",
        "name": "PLYR",
        "decimals": 18,
        "logoUri": ""
      },
      "sybilResistanceType": "Proof of Authority"
    }
  ],
  "isL1": true
}
