{
  "subnetId": "4onzNay6p7oru7GfZLCMrXhxvUqtmoC4vz8r8ev9e7r2C5wju",
  "network": "mainnet",
  "categories": [
    "AI"
  ],
  "name": "Orange",
  "description": "Purpose-built for AI-native creators. Orange Web3 provides the tools to turn AI-assisted and vibe coded ideas into live products, backed by on-chain rewards and an active user ecosystem.",
  "logo": "https://cdn.snowpeer.io/orange.png",
  "website": "https://www.orangeweb3.com",
  "socials": [],
  "chains": [
    {
      "blockchainId": "AowVWzuCAyLrTPSLHHaHeMJSdxRhhWbvmEuXncPnKv1hT5wf4",
      "name": "Orange",
      "description": "Orange L1 is The Creator Network. Purpose-built for AI-native creators, Orange provides the tools to turn AI-assisted and vibe coded ideas into live products, backed by on-chain rewards and an active user ecosystem.\n",
      "evmChainId": 1510,
      "vmName": "EVM",
      "vmId": "",
      "rpcUrls": [
        "https://subnets.avax.network/orange/mainnet/rpc"
      ],
      "nativeToken": {
        "symbol": "JUICE",
        "name": "JUICE",
        "decimals": 18,
        "logoUri": "https://images.ctfassets.net/gcj8jwzm6086/4jmmb8oMQwW5My8YYcEmAx/ee1f1cef8766cc934e9190c5c1c7fa21/Orange_Logo_Mark_Slightly_Padded.png"
      },
      "sybilResistanceType": "Proof of Authority",
      "explorerUrl": "https://explorer.avax.network/orange"
    }
  ],
  "isL1": true
}
