{
  "subnetId": "q54cgHa9RN2NFp9qsfpPzVkhgn8xqDgKEQR1G997xZ1P5Dc8o",
  "network": "mainnet",
  "categories": [],
  "name": "EthixEtx",
  "description": "",
  "logo": "",
  "website": "",
  "socials": [],
  "chains": [
    {
      "blockchainId": "2R87vuaaRZRxPLdvdMEpo7fH9qyyNnP34h4nyxuwq8sKkQ1GaE",
      "name": "EthixEtx",
      "description": "",
      "evmChainId": 389,
      "vmName": "EVM",
      "vmId": "",
      "rpcUrls": [
        "https://subnets.avax.network/etx/mainnet/rpc"
      ],
      "nativeToken": {
        "symbol": "ETX",
        "name": "ETX",
        "decimals": 18,
        "logoUri": "https://images.ctfassets.net/gcj8jwzm6086/62KzIedYATHGgRODAP5Py9/e290f4d8598ac8d30d80975a560cca8f/AvaCloud-512x512.png"
      },
      "sybilResistanceType": "Proof of Authority"
    }
  ],
  "isL1": true
}
