{
  "subnetId": "2nCzBViQ5jxLaxkg9TABx6oXu1UGU7chM7G6XzPvW9ehP8RfrJ",
  "network": "mainnet",
  "categories": [
    "GAMING"
  ],
  "name": "NUMINE",
  "description": "NUMINE serves as a Web 3.0 gaming platform that functions as a chain and ecosystem, allowing content developers and users to collectively influence the direction of the industry.",
  "logo": "https://cdn.snowpeer.io/numine.png",
  "website": "https://numine.io",
  "socials": [
    {
      "name": "twitter",
      "url": "https://x.com/numineverse"
    },
    {
      "name": "telegram",
      "url": "https://t.me/numineverse"
    },
    {
      "name": "discord",
      "url": "https://discord.com/invite/numine"
    },
    {
      "name": "medium",
      "url": "https://medium.com/@numineverse"
    }
  ],
  "chains": [
    {
      "blockchainId": "2c1BN4N9qEhNmW4yCpeLK24SfjFQLyS1Z7FtgRDaYxZWFUUKxf",
      "name": "numine",
      "description": "NUMINE serves as a Web 3.0 gaming platform that functions as a chain and ecosystem, allowing content developers and users to collectively influence the direction of the industry.\nNUMNE offers an effective and convenient solution for developers seeking high-quality content and users desiring an optimal blockchain experience. ",
      "evmChainId": 8021,
      "vmName": "EVM",
      "vmId": "bVvAsrLWieiBKwjttxdaYRDaTDmn5ixjN5bDp8fJekCJLiVQE",
      "rpcUrls": [
        "https://subnets.avax.network/numi/mainnet/rpc"
      ],
      "nativeToken": {
        "symbol": "NUMINE",
        "name": "NUMINE",
        "decimals": 18,
        "logoUri": "https://images.ctfassets.net/gcj8jwzm6086/411JTIUnbER3rI5dpOR54Y/3c0a8e47d58818a66edd868d6a03a135/numine_main_icon.png"
      },
      "sybilResistanceType": "Proof of Authority",
      "explorerUrl": "https://subnets.avax.network/numi"
    }
  ],
  "isL1": true
}
