{
  "subnetId": "LbvSkGmUJSpUby1gUrk4g9mmdeZQWcVGiFCXv57CJHBrxxEos",
  "network": "mainnet",
  "categories": [
    "LOYALTY"
  ],
  "name": "MUGEN",
  "description": "MUGEN mainnet",
  "logo": "https://cdn.snowpeer.io/mugen.png",
  "website": "",
  "socials": [
    {
      "name": "twitter",
      "url": "https://x.com/buildonmugen"
    }
  ],
  "chains": [
    {
      "blockchainId": "2GiVhBPR19ZaHYQivmheYv8RkEBjfdu7AyDvSocbWWjR4gz1qf",
      "name": "MUGEN",
      "description": "",
      "evmChainId": 29111,
      "vmName": "EVM",
      "vmId": "b4NW8Cm5c1UEjiP7pLfCKjhfpGQMp3KEvKvFzG9XsHhuUrQGa",
      "explorerUrl": "https://subnets.avax.network/mugen",
      "rpcUrls": ["https://29111.rpc.thirdweb.com"],
      "nativeToken": {
        "symbol": "MGN",
        "name": "MGN",
        "decimals": 18,
        "logoUri": "https://cdn.snowpeer.io/mugen.png"
      },
      "sybilResistanceType": "Proof of Authority"
    }
  ],
  "isL1": true
}
