{
  "subnetId": "oerPWBbtbe13eWbo3AegYUrHuSETeTwyNy7szoHJJ1QQBL9nu",
  "network": "mainnet",
  "categories": [
    "RWA"
  ],
  "name": "Innovo Markets",
  "description": "Innovo Markets offers a digital platform for renewable energy certificate (REC) transactions, ensuring faster, transparent, and cost-effective settlements. It supports real-time data reporting, compliance tracking, and simplified portfolio management. The platform enhances efficiency in the renewable energy market by integrating with REC marketplaces.",
  "logo": "https://cdn.snowpeer.io/innova.png",
  "website": "https://www.innovomarkets.com/",
  "socials": [
    {
      "name": "twitter",
      "url": "https://x.com/InnovoMarkets"
    },
    {
      "name": "linkedin",
      "url": "https://www.linkedin.com/company/innovo-markets/"
    }
  ],
  "chains": [
    {
      "blockchainId": "vFHT9J4F6PhqCTMmqkKKUKW3yfsjd6tNvhmcK4MkFa3Pmnnqe",
      "name": "InnovoMarketsMainnet",
      "description": "Innovo Markets Network powering markets.",
      "evmChainId": 10036,
      "vmName": "EVM",
      "vmId": "ZLhwWNLcKhATKbjmGHpSKv9YJ6B462yLyq6eb4CkkD78zCoJZ",
      "rpcUrls": [
        "https://subnets.avax.network/innovo/mainnet/rpc"
      ],
      "nativeToken": {
        "symbol": "INN",
        "name": "Innovo Network",
        "decimals": 18
      }
    }
  ]
}
