{
  "subnetId": "jmLmezoViv3F72XLzpdmSNk3qLEGb72g5EYkp3ij4wHXPF2KN",
  "network": "mainnet",
  "categories": [
    "GAMING"
  ],
  "name": "Henesys",
  "description": "",
  "logo": "https://cdn.snowpeer.io/henesys.png",
  "website": "https://msu.io/",
  "socials": [],
  "chains": [
    {
      "blockchainId": "2LFmzhHDKxkreihEtPanVmofuFn63bsh8twnRXEbDhBtCJxURB",
      "name": "Henesys",
      "description": "The Henesys L1 drives the MapleStory Universe, a groundbreaking expansion of Nexon's iconic MapleStory franchise. MapleStory Universe is an innovative virtual world ecosystem that leverages thepower of blockchain technology to deliver a truly immersive and dynamic experience. By integrating digital scarcity, open ecosystems, and MapleStory NFTs at its core, it creates a revolutionary platform that promises to redefine the future of gaming and digital ownership.",
      "evmChainId": 68414,
      "vmName": "EVM",
      "vmId": "YtGKetwQgUADapTEJBQCfS2EcH55x4hyjrFiJBaooiUd1X17v",
      "rpcUrls": [
        "https://henesys-rpc.msu.io"
      ],
      "nativeToken": {
        "symbol": "NXPC",
        "name": "NEXPACE",
        "decimals": 18,
        "logoUri": "https://images.ctfassets.net/gcj8jwzm6086/4vLq0seR2nSWK79ldnXnKR/c63f65587cc5da3dae7a8bc087792dc9/NEXPACE_TICKER_Color.png"
      },
      "sybilResistanceType": "Proof of Authority",
      "explorerUrl": "https://subnets.avax.network/henesys"
    }
  ],
  "isL1": true
}
